<!DOCTYPE maps SYSTEM "../../../lib/tools/dtd/MapsDefinition2.0.dtd">
<maps>
  <map>
    <map-name>ImageBlockCacheMap</map-name>
    <schema>
      <schema-major>1</schema-major>
      <schema-minor>1</schema-minor>
    </schema>
    <member>
      <member-name>userId</member-name>
      <member-type>INTEGER</member-type>
      <required/>
    </member>
    <member>
      <member-name>itemType</member-name>
      <member-type>INTEGER</member-type>
      <required/>
    </member>
    <member>
      <member-name>itemTimestamp</member-name>
      <member-type>INTEGER</member-type>
      <required/>
    </member>
    <member>
      <member-name>itemId</member-name>
      <member-type>INTEGER</member-type>
      <required/>
    </member>
    <index>
      <member-name>userId</member-name>
      <member-name>itemType</member-name>
    </index>
  </map>
  <map>
    <map-name>ImageBlockDisabledMap</map-name>
    <schema>
      <schema-major>1</schema-major>
      <schema-minor>0</schema-minor>
    </schema>
    <member>
      <member-name>itemId</member-name>
      <member-type>INTEGER</member-type>
      <primary/>
    </member>
  </map>
</maps>
